                                     SECTION A

QUESTION 1                    

mysql> create database company;
Query OK, 1 row affected (0.02 sec)

mysql> use company;
Database changed
mysql> create table client_master(clientNO int,name varchar(70),adress varchar(70),city varchar(70),state varchar(50),bal_due int);
Query OK, 0 rows affected (0.03 sec)

mysql> insert into client_master values(1,"william","kk509","kigali","Rwanda",1500);
Query OK, 1 row affected (0.01 sec)

mysql> insert into client_master values(2,"Neemah","AG509","ottawa","America",5500);
Query OK, 1 row affected (0.00 sec)

mysql> insert into client_master values(3,"Nickyy","RR509","Butare","rwanda",500);
Query OK, 1 row affected (0.00 sec)

mysql> insert into client_master values(4,"Derrick","north","musanze","rwanda",6500);
Query OK, 1 row affected (0.00 sec)

mysql> insert into client_master values(5,"henry","east","nyagatare","rwanda",100);
Query OK, 1 row affected (0.00 sec)

mysql> select * from client_master;
+----------+---------+--------+-----------+---------+---------+
| clientNO | name    | adress | city      | state   | bal_due |
+----------+---------+--------+-----------+---------+---------+
|        1 | william | kk509  | kigali    | Rwanda  |    1500 |
|        2 | Neemah  | AG509  | ottawa    | America |    5500 |
|        3 | Nickyy  | RR509  | Butare    | rwanda  |     500 |
|        4 | Derrick | north  | musanze   | rwanda  |    6500 |
|        5 | henry   | east   | nyagatare | rwanda  |     100 |
+----------+---------+--------+-----------+---------+---------+
5 rows in set (0.00 sec)

Q2)

mysql> select * from client_master where bal_due>5000;
+----------+---------+--------+---------+---------+---------+
| clientNO | name    | adress | city    | state   | bal_due |
+----------+---------+--------+---------+---------+---------+
|        2 | Neemah  | AG509  | ottawa  | America |    5500 |
|        4 | Derrick | north  | musanze | rwanda  |    6500 |
+----------+---------+--------+---------+---------+---------+
2 rows in set (0.00 sec)

Q3)

mysql> update client_master set bal_due=5100 where clientNO=3;
Query OK, 1 row affected (0.00 sec)
Rows matched: 1  Changed: 1  Warnings: 0

mysql> select * from client_master;
+----------+---------+--------+-----------+---------+---------+
| clientNO | name    | adress | city      | state   | bal_due |
+----------+---------+--------+-----------+---------+---------+
|        1 | william | kk509  | kigali    | Rwanda  |    1500 |
|        2 | Neemah  | AG509  | ottawa    | America |    5500 |
|        3 | Nickyy  | RR509  | Butare    | rwanda  |    5100 |
|        4 | Derrick | north  | musanze   | rwanda  |    6500 |
|        5 | henry   | east   | nyagatare | rwanda  |     100 |
+----------+---------+--------+-----------+---------+---------+
5 rows in set (0.00 sec)

Q4)

mysql> rename table client_master to client12;
Query OK, 0 rows affected (0.03 sec)

mysql> select * from client12;
+----------+---------+--------+-----------+---------+---------+
| clientNO | name    | adress | city      | state   | bal_due |
+----------+---------+--------+-----------+---------+---------+
|        1 | william | kk509  | kigali    | Rwanda  |    1500 |
|        2 | Neemah  | AG509  | ottawa    | America |    5500 |
|        3 | Nickyy  | RR509  | Butare    | rwanda  |    5100 |
|        4 | Derrick | north  | musanze   | rwanda  |    6500 |
|        5 | henry   | east   | nyagatare | rwanda  |     100 |
+----------+---------+--------+-----------+---------+---------+
5 rows in set (0.00 sec)

                       SECTION B
Q6)

a)

mysql> create table departments(dept_id varchar(20),department_name varchar(70),salary varchar(10));
Query OK, 0 rows affected (0.02 sec)

mysql> create table employees(emp_id varchar(20),emp_name varchar(70),salary varchar(10));
Query OK, 0 rows affected (0.02 sec)

mysql> insert into departments values(01,"HRM",300000);
Query OK, 1 row affected (0.00 sec)

mysql> insert into departments values(21,"ADMIN",500000);
Query OK, 1 row affected (0.00 sec)

mysql> insert into departments values(501,"cleaners",70000);
Query OK, 1 row affected (0.00 sec)

mysql> insert into departments values(201,"sales and marketing",180000);
Query OK, 1 row affected (0.00 sec)

mysql> insert into departments values(1001,"procurement department",700000);
Query OK, 1 row affected (0.00 sec)

mysql> select* from departments;
+---------+------------------------+--------+
| dept_id | department_name        | salary |
+---------+------------------------+--------+
| 1       | HRM                    | 300000 |
| 21      | ADMIN                  | 500000 |
| 501     | cleaners               | 70000  |
| 201     | sales and marketing    | 180000 |
| 1001    | procurement department | 700000 |
+---------+------------------------+--------+
5 rows in set (0.00 sec)


mysql> insert into employees values("emp1","TETA ANGE",180000);
Query OK, 1 row affected (0.00 sec)

mysql> insert into employees values("emp101","donny",800000);
Query OK, 1 row affected (0.00 sec)

mysql> insert into employees values("emp201","clever",90000);
Query OK, 1 row affected (0.00 sec)

mysql> insert into employees values("emp201","clever",90000);
Query OK, 1 row affected (0.00 sec)

mysql> insert into employees values("emp201","clever",90000);
Query OK, 1 row affected (0.00 sec)

mysql> insert into employees values("emp41","neever",910000);
Query OK, 1 row affected (0.00 sec)

mysql> select * from employees;
+--------+-----------+--------+
| emp_id | emp_name  | salary |
+--------+-----------+--------+
| emp1   | TETA ANGE | 180000 |
| emp101 | donny     | 800000 |
| emp201 | clever    | 90000  |
| emp201 | clever    | 90000  |
| emp201 | clever    | 90000  |
| emp41  | neever    | 910000 |
+--------+-----------+--------+
6 rows in set (0.00 sec)

b)

mysql> describe employees;
+----------+-------------+------+-----+---------+-------+
| Field    | Type        | Null | Key | Default | Extra |
+----------+-------------+------+-----+---------+-------+
| emp_id   | varchar(20) | YES  |     | NULL    |       |
| emp_name | varchar(70) | YES  |     | NULL    |       |
| salary   | varchar(10) | YES  |     | NULL    |       |
+----------+-------------+------+-----+---------+-------+
3 rows in set (0.03 sec)

c)

mysql> select employees.emp_Name, departments.Department_Name from employees left join departments on employees.Emp_Id=departments.Dept_Id;
+-----------+-----------------+
| emp_Name  | Department_Name |
+-----------+-----------------+
| TETA ANGE | NULL            |
| donny     | NULL            |
| clever    | NULL            |
| clever    | NULL            |
| clever    | NULL            |
| neever    | NULL            |
+-----------+-----------------+
6 rows in set (0.02 sec)

d)


mysql> select employees.emp_Name, departments.Department_Name from employees right join departments on employees.Emp_Id=departments.Dept_Id;
+----------+------------------------+
| emp_Name | Department_Name        |
+----------+------------------------+
| NULL     | HRM                    |
| NULL     | ADMIN                  |
| NULL     | cleaners               |
| NULL     | sales and marketing    |
| NULL     | procurement department |
+----------+------------------------+
5 rows in set (0.00 sec)

e)

mysql> SELECT *FROM employees WHERE salary > (SELECT AVG(salary) FROM employees);
+--------+----------+--------+
| emp_id | emp_name | salary |
+--------+----------+--------+
| emp101 | donny    | 800000 |
| emp41  | neever   | 910000 |
+--------+----------+--------+
2 rows in set (0.01 sec)


             QUESTION 7

mysql>  create table student(studentid varchar(5),fullnames varchar(25),gender varchar(6),age int(2),department varchar(30));
Query OK, 0 rows affected, 1 warning (0.02 sec)

mysql> describe student;
+------------+-------------+------+-----+---------+-------+
| Field      | Type        | Null | Key | Default | Extra |
+------------+-------------+------+-----+---------+-------+
| studentid  | varchar(5)  | YES  |     | NULL    |       |
| fullnames  | varchar(25) | YES  |     | NULL    |       |
| gender     | varchar(6)  | YES  |     | NULL    |       |
| age        | int         | YES  |     | NULL    |       |
| department | varchar(30) | YES  |     | NULL    |       |
+------------+-------------+------+-----+---------+-------+
5 rows in set (0.00 sec)

1)

mysql> create view studentlistview as select studentid,fullnames,gender,age,department from student;
Query OK, 0 rows affected (0.02 sec)

mysql> describe studentlistview;
+------------+-------------+------+-----+---------+-------+
| Field      | Type        | Null | Key | Default | Extra |
+------------+-------------+------+-----+---------+-------+
| studentid  | varchar(5)  | YES  |     | NULL    |       |
| fullnames  | varchar(25) | YES  |     | NULL    |       |
| gender     | varchar(6)  | YES  |     | NULL    |       |
| age        | int         | YES  |     | NULL    |       |
| department | varchar(30) | YES  |     | NULL    |       |
+------------+-------------+------+-----+---------+-------+
5 rows in set (0.00 sec)

2)

mysql> create view listofgirls as select studentid,fullnames,gender,age,department from student where gender="female";
Query OK, 0 rows affected (0.02 sec)
mysql> select * from listofgirls;
+-----------+-----------+--------+------+------------+
| studentid | fullnames | gender | age  | department |
+-----------+-----------+--------+------+------------+
| 22300     | neemah    | female |   22 | BIT        |
+-----------+-----------+--------+------+------------+


3)

mysql> create view listofboys as select studentid,fullnames,gender,age,department from student where gender="male";
Query OK, 0 rows affected (0.02 sec)

mysql> select * from listofboys;
+-----------+-----------+--------+------+------------+
| studentid | fullnames | gender | age  | department |
+-----------+-----------+--------+------+------------+
| 22350     | nicky     | male   |   19 | BIT        |
+-----------+-----------+--------+------+------------+
1 row in set (0.00 sec)

4)

mysql> insert into student values(223000,"neemah","female",22,"BIT");
Query OK, 1 row affected, 1 warning (0.00 sec)

mysql> insert into student values(2235080,"nicky","male",19,"BIT");
Query OK, 1 row affected, 1 warning (0.00 sec)

mysql> select * from student;
+-----------+-----------+--------+------+------------+
| studentid | fullnames | gender | age  | department |
+-----------+-----------+--------+------+------------+
| 22300     | neemah    | female |   22 | BIT        |
| 22350     | nicky     | male   |   19 | BIT        |
+-----------+-----------+--------+------+------------+
2 rows in set (0.00 sec)

5)

mysql> delete from student where age<20;
Query OK, 1 row affected (0.01 sec)

mysql> select * from student;
+-----------+-----------+--------+------+------------+
| studentid | fullnames | gender | age  | department |
+-----------+-----------+--------+------+------------+
| 22300     | neemah    | female |   22 | BIT        |
+-----------+-----------+--------+------+------------+
1 row in set (0.00 sec)

                        SECTION C

QUESTION 9

create table EMPLOYEE (employee_id varchar(6),first_name varchar(20),lastname varchar(30),email varchar(30),phone_number varchar(15),hired_date date,job_id varchar(20),salary varchar(10),commission_pct varchar(20),manager_id varchar(5),department_id varchar(10));
Query OK, 0 rows affected (0.02 sec)

mysql> describe EMPLOYEE;
+----------------+-------------+------+-----+---------+-------+
| Field          | Type        | Null | Key | Default | Extra |
+----------------+-------------+------+-----+---------+-------+
| employee_id    | varchar(6)  | YES  |     | NULL    |       |
| first_name     | varchar(20) | YES  |     | NULL    |       |
| lastname       | varchar(30) | YES  |     | NULL    |       |
| email          | varchar(30) | YES  |     | NULL    |       |
| phone_number   | varchar(15) | YES  |     | NULL    |       |
| hired_date     | date        | YES  |     | NULL    |       |
| job_id         | varchar(20) | YES  |     | NULL    |       |
| salary         | varchar(10) | YES  |     | NULL    |       |
| commission_pct | varchar(20) | YES  |     | NULL    |       |
| manager_id     | varchar(5)  | YES  |     | NULL    |       |
| department_id  | varchar(10) | YES  |     | NULL    |       |
+----------------+-------------+------+-----+---------+-------+
11 rows in set (0.00 sec)

mysql> insert into employee values("emp001","hennry","billy","billy@gmail.com",078888987,"2020-11-1","HR01","350000","30000","ADMIN01","DEPT001");
Query OK, 1 row affected, 1 warning (0.00 sec)

mysql> insert into employee values("emp005","honnry","ally","ally@gmail.com",0799008987,"2025-01-1","marketing01","400000","10000",100,"DEPT101");
Query OK, 1 row affected (0.00 sec)

mysql> insert into employee values("emp005","honnry","ally","ally@gmail.com",0799008987,"2025-01-1","marketing01","400000","10000",100,"DEPT101");
Query OK, 1 row affected (0.00 sec)

mysql> select* from employee;
+-------------+------------+----------+-----------------+--------------+------------+-------------+--------+----------------+------------+---------------+
| employee_id | first_name | lastname | email           | phone_number | hired_date | job_id      | salary | commission_pct | manager_id | department_id |
+-------------+------------+----------+-----------------+--------------+------------+-------------+--------+----------------+------------+---------------+
| emp001      | hennry     | billy    | billy@gmail.com | 78888987     | 2020-11-01 | HR01        | 350000 | 30000          | ADMIN      | DEPT001       |
| emp005      | honnry     | ally     | ally@gmail.com  | 799008987    | 2025-01-01 | marketing01 | 400000 | 10000          | ADMIN      | DEPT101       |
| emp005      | honnry     | ally     | ally@gmail.com  | 799008987    | 2025-01-01 | marketing01 | 400000 | 10000          | 100        | DEPT101       |
+-------------+------------+----------+-----------------+--------------+------------+-------------+--------+----------------+------------+---------------+
3 rows in set (0.00 sec)

a)

mysql> select employee_id,first_name,lastname,salary from employee;
+-------------+------------+----------+--------+
| employee_id | first_name | lastname | salary |
+-------------+------------+----------+--------+
| emp001      | hennry     | billy    | 350000 |
| emp005      | honnry     | ally     | 400000 |
+-------------+------------+----------+--------+
2 rows in set (0.00 sec)

b)

mysql> SELECT first_name,lastname FROM employee WHERE manager_id = 100;
+------------+----------+
| first_name | lastname |
+------------+----------+
| honnry     | ally     |
+------------+----------+
1 row in set, 2 warnings (0.00 sec)

c)

mysql> SELECT * FROM employee WHERE salary > 4800;
+-------------+------------+----------+-----------------+--------------+------------+-------------+--------+----------------+------------+---------------+
| employee_id | first_name | lastname | email           | phone_number | hired_date | job_id      | salary | commission_pct | manager_id | department_id |
+-------------+------------+----------+-----------------+--------------+------------+-------------+--------+----------------+------------+---------------+
| emp001      | hennry     | billy    | billy@gmail.com | 78888987     | 2020-11-01 | HR01        | 350000 | 30000          | ADMIN      | DEPT001       |
| emp005      | honnry     | ally     | ally@gmail.com  | 799008987    | 2025-01-01 | marketing01 | 400000 | 10000          | ADMIN      | DEPT101       |
| emp005      | honnry     | ally     | ally@gmail.com  | 799008987    | 2025-01-01 | marketing01 | 400000 | 10000          | 100        | DEPT101       |
+-------------+------------+----------+-----------------+--------------+------------+-------------+--------+----------------+------------+---------------+
3 rows in set (0.00 sec)


d)

mysql> select * from employee where lastname="AUSTIN";
Empty set (0.00 sec)

e)

mysql> select employee_id,first_name,lastname from employee where department_id="DEPT001";
+-------------+------------+----------+
| employee_id | first_name | lastname |
+-------------+------------+----------+
| emp001      | hennry     | billy    |
+-------------+------------+----------+
1 row in set (0.00 sec)

           QUESTION 10

mysql> create table sales (salesNO integer,salesname varchar(20),branch varchar(20),salesamount varchar(20),DOB date);
Query OK, 0 rows affected (0.03 sec)

mysql> describe sales;
+-------------+-------------+------+-----+---------+-------+
| Field       | Type        | Null | Key | Default | Extra |
+-------------+-------------+------+-----+---------+-------+
| salesNO     | int         | YES  |     | NULL    |       |
| salesname   | varchar(20) | YES  |     | NULL    |       |
| branch      | varchar(20) | YES  |     | NULL    |       |
| salesamount | varchar(20) | YES  |     | NULL    |       |
| DOB         | date        | YES  |     | NULL    |       |
+-------------+-------------+------+-----+---------+-------+
5 rows in set (0.00 sec)

a)

mysql> insert into sales values(10,"mugisha","gatuna","150kg","2009-12-21");
Query OK, 1 row affected (0.00 sec)

mysql>  insert into sales values(110,"mark","butare","450kg","2019-02-11");
Query OK, 1 row affected (0.00 sec)

mysql>  insert into sales values(1101,"mike","butare","450kg","1909-02-11");
Query OK, 1 row affected (0.00 sec)

mysql>  insert into sales values(1121,"millye","burera","50kg","2020-10_01");
Query OK, 1 row affected, 1 warning (0.00 sec)

mysql>  insert into sales values(0021,"miggie","muhanga","1050kg","2000-08_01");
Query OK, 1 row affected, 1 warning (0.00 sec)

mysql> select* from sales;
+---------+-----------+---------+-------------+------------+
| salesNO | salesname | branch  | salesamount | DOB        |
+---------+-----------+---------+-------------+------------+
|    1101 | mike      | butare  | 450kg       | 1909-02-11 |
|    1121 | millye    | burera  | 50kg        | 2020-10-01 |
|     110 | mark      | butare  | 450kg       | 2019-02-11 |
|      10 | mugisha   | gatuna  | 150kg       | 2009-12-21 |
|      21 | miggie    | muhanga | 1050kg      | 2000-08-01 |
+---------+-----------+---------+-------------+------------+
5 rows in set (0.00 sec)

b)

mysql> select sum(salesamount),branch from sales group by branch;
+------------------+---------+
| sum(salesamount) | branch  |
+------------------+---------+
|              900 | butare  |
|               50 | burera  |
|              150 | gatuna  |
|             1050 | muhanga |
+------------------+---------+
4 rows in set (0.01 sec)

c)

mysql> select avg(salesamount),branch from sales group by branch;
+------------------+---------+
| avg(salesamount) | branch  |
+------------------+---------+
|              450 | butare  |
|               50 | burera  |
|              150 | gatuna  |
|             1050 | muhanga |
+------------------+---------+
4 rows in set (0.01 sec)

d)


mysql> select salesname,dob from sales where dob='2009-12-21';
+-----------+------------+
| salesname | dob        |
+-----------+------------+
| mugisha   | 2009-12-21 |
+-----------+------------+
1 row in set (0.02 sec)

e)

mysql> SELECT salesname, DOB FROM sales ORDER BY MONTH(DOB);
+-----------+------------+
| salesname | DOB        |
+-----------+------------+
| mike      | 1909-02-11 |
| mark      | 2019-02-11 |
| miggie    | 2000-08-01 |
| millye    | 2020-10-01 |
| mugisha   | 2009-12-21 |
+-----------+------------+
5 rows in set (0.00 sec)
 
